Gene,Description,Entrez Gene,GeneCards,UniProtKB/Swiss-Prot,Tocris,CIViC
FNIP1,Gene - Folliculin Interacting Protein 1,"This gene encodes a protein that binds to the tumor suppressor protein folliculin and to AMP-activated protein kinase (AMPK). The encoded protein participates in the regulation of cellular metabolism and nutrient sensing by modulating the AMPK and target of rapamycin signaling pathways. This gene has a closely related paralog that encodes a protein with similar binding activities. Both related proteins also associate with the molecular chaperone heat shock protein-90 (Hsp90) and negatively regulate its ATPase activity and facilitate its association with folliculin. [provided by RefSeq, Jul 2017]",FNIP1 (Folliculin Interacting Protein 1) is a Protein Coding gene. Diseases associated with FNIP1 include Immunodeficiency 93 And Hypertrophic Cardiomyopathy and Interdigitating Dendritic Cell Sarcoma. Among its related pathways are Cellular responses to stimuli and Peptide chain elongation. Gene Ontology (GO) annotations related to this gene include guanyl-nucleotide exchange factor activity. An important paralog of this gene is FNIP2.,"Binding partner of the GTPase-activating protein FLCN: involved in the cellular response to amino acid availability by regulating the mTORC1 signaling cascade controlling the MiT/TFE factors TFEB and TFE3 (PubMed:17028174, PubMed:18663353, PubMed:24081491). In low-amino acid conditions, component of the lysosomal folliculin complex (LFC) on the membrane of lysosomes, which inhibits the GTPase-activating activity of FLCN, thereby inactivating mTORC1 and promoting nuclear translocation of TFEB and TFE3 (By similarity). Upon amino acid restimulation, disassembly of the LFC complex liberates the GTPase-activating activity of FLCN, leading to activation of mTORC1 and subsequent cytoplasmic retention of TFEB and TFE3 (By similarity). Required to promote FLCN recruitment to lysosomes and interaction with Rag GTPases (PubMed:24081491). Together with FLCN, regulates autophagy: following phosphorylation by ULK1, interacts with GABARAP and promotes autophagy (PubMed:25126726). In addition to its role in mTORC1 signaling, also acts as a co-chaperone of HSP90AA1/Hsp90: following gradual phosphorylation by CK2, inhibits the ATPase activity of HSP90AA1/Hsp90, leading to activate both kinase and non-kinase client proteins of HSP90AA1/Hsp90 (PubMed:27353360, PubMed:30699359). Acts as a scaffold to load client protein FLCN onto HSP90AA1/Hsp90 (PubMed:27353360). Competes with the activating co-chaperone AHSA1 for binding to HSP90AA1, thereby providing a reciprocal regulatory mechanism for chaperoning of client proteins (PubMed:27353360). Also acts as a core component of the reductive stress response by inhibiting activation of mitochondria in normal conditions: in response to reductive stress, the conserved Cys degron is reduced, leading to recognition and polyubiquitylation by the CRL2(FEM1B) complex, followed by proteasomal (By similarity). Required for B-cell development (By similarity). FNIP1_HUMAN,Q8TF40",,
EBF1,Gene - EBF Transcription Factor 1,"Predicted to enable DNA-binding transcription activator activity, RNA polymerase II-specific and RNA polymerase II cis-regulatory region sequence-specific DNA binding activity. Predicted to be involved in positive regulation of transcription by RNA polymerase II. Predicted to act upstream of or within positive regulation of transcription, DNA-templated. Predicted to be located in nucleus. Predicted to be part of chromatin. [provided by Alliance of Genome Resources, Apr 2022]",EBF1 (EBF Transcription Factor 1) is a Protein Coding gene. Diseases associated with EBF1 include Plasmacytoma and B-Lymphoblastic Leukemia/Lymphoma With Etv6-Runx1. Among its related pathways are Adipogenesis and White fat cell differentiation. Gene Ontology (GO) annotations related to this gene include DNA-binding transcription factor activity and C2H2 zinc finger domain binding. An important paralog of this gene is EBF3.,"Key pioneer transcription factor of B-cell specification and commitment (PubMed:27807034). Recognizes variations of the palindromic sequence 5'-ATTCCCNNGGGAATT-3'. Operates in a transcription factor network to activate B-cell-specific genes and repress genes associated with alternative cell fates. For instance, positively regulates many B-cell specific genes including BCR or CD40 while repressing genes that direct cells into alternative lineages, including GATA3 and TCF7 for the T-cell lineage. In addition to its role during lymphopoiesis, controls the thermogenic gene program in adipocytes during development and in response to environmental cold (By similarity). COE1_HUMAN,Q9UH73",,
CPEB4,Gene - Cytoplasmic Polyadenylation Element Binding Protein 4,"Enables RNA binding activity. Predicted to be involved in several processes, including cellular response to glucose starvation; negative regulation of cytoplasmic translation; and response to ischemia. Located in cytoplasm and nucleus. Biomarker of liver cirrhosis; portal hypertension; and primary biliary cholangitis. [provided by Alliance of Genome Resources, Apr 2022]",CPEB4 (Cytoplasmic Polyadenylation Element Binding Protein 4) is a Protein Coding gene. Diseases associated with CPEB4 include Primary Biliary Cholangitis. Among its related pathways are Nuclear receptors meta-pathway and Glucocorticoid receptor pathway. Gene Ontology (GO) annotations related to this gene include nucleic acid binding and RNA binding. An important paralog of this gene is CPEB2.,"Sequence-specific RNA-binding protein that binds to the cytoplasmic polyadenylation element (CPE), an uridine-rich sequence element (consensus sequence 5'-UUUUUAU-3') within the mRNA 3'-UTR (PubMed:24990967). RNA binding results in a clear conformational change analogous to the Venus fly trap mechanism (PubMed:24990967). Regulates activation of unfolded protein response (UPR) in the process of adaptation to ER stress in liver, by maintaining translation of CPE-regulated mRNAs in conditions in which global protein synthesis is inhibited (By similarity). Required for cell cycle progression, specifically for cytokinesis and chromosomal segregation (PubMed:26398195). Plays a role as an oncogene promoting tumor growth and progression by positively regulating translation of t-plasminogen activator/PLAT (PubMed:22138752). Stimulates proliferation of melanocytes (PubMed:27857118). In contrast to CPEB1 and CPEB3, does not play role in synaptic plasticity, learning and memory (By similarity). CPEB4_HUMAN,Q17RY0",,
FOXC1,Gene - Forkhead Box C1,"This gene belongs to the forkhead family of transcription factors which is characterized by a distinct DNA-binding forkhead domain. The specific function of this gene has not yet been determined; however, it has been shown to play a role in the regulation of embryonic and ocular development. Mutations in this gene cause various glaucoma phenotypes including primary congenital glaucoma, autosomal dominant iridogoniodysgenesis anomaly, and Axenfeld-Rieger anomaly. [provided by RefSeq, Jul 2008]","FOXC1 (Forkhead Box C1) is a Protein Coding gene. Diseases associated with FOXC1 include Anterior Segment Dysgenesis 3 and Axenfeld-Rieger Syndrome, Type 3. Among its related pathways are Transcriptional Regulatory Network in Embryonic Stem Cell and Mesodermal commitment pathway. Gene Ontology (GO) annotations related to this gene include DNA-binding transcription factor activity and transcription factor binding. An important paralog of this gene is FOXC2.","DNA-binding transcriptional factor that plays a role in a broad range of cellular and developmental processes such as eye, bones, cardiovascular, kidney and skin development (PubMed:11782474, PubMed:15299087, PubMed:15684392, PubMed:16492674, PubMed:27907090, PubMed:14506133, PubMed:14578375, PubMed:15277473, PubMed:16449236, PubMed:17210863, PubMed:19793056, PubMed:19279310, PubMed:25786029, PubMed:27804176). Acts either as a transcriptional activator or repressor (PubMed:11782474). Binds to the consensus binding site 5'-[G/C][A/T]AAA[T/C]AA[A/C]-3' in promoter of target genes (PubMed:7957066, PubMed:11782474, PubMed:12533514, PubMed:14506133, PubMed:19793056, PubMed:27804176). Upon DNA-binding, promotes DNA bending (PubMed:7957066, PubMed:14506133). Acts as a transcriptional coactivator (PubMed:26565916). Stimulates Indian hedgehog (Ihh)-induced target gene expression mediated by the transcription factor GLI2, and hence regulates endochondral ossification (By similarity). Acts also as a transcriptional coregulator by increasing DNA-binding capacity of GLI2 in breast cancer cells (PubMed:26565916). Regulates FOXO1 through binding to a conserved element, 5'-GTAAACAAA-3' in its promoter region, implicating FOXC1 as an important regulator of cell viability and resistance to oxidative stress in the eye (PubMed:17993506). Cooperates with transcription factor FOXC2 in regulating expression of genes that maintain podocyte integrity (By similarity). Promotes cell growth inhibition by stopping the cell cycle in the G1 phase through TGFB1-mediated signals (PubMed:12408963). Involved in epithelial-mesenchymal transition (EMT) induction by increasing cell proliferation, migration and invasion (PubMed:20406990, PubMed:22991501). Involved in chemokine CXCL12-induced endothelial cell migration through the control of CXCR4 expression (By similarity). Plays a role in the gene regulatory network essential for epidermal keratinocyte terminal differentiation (PubMed:27907090). Essential developmental transcriptional factor required for mesoderm-derived tissues, such as the somites, skin, bone and cartilage. Positively regulates CXCL12 and stem cell factor expression in bone marrow mesenchymal progenitor cells, and hence plays a role in the development and maintenance of mesenchymal niches for haematopoietic stem and progenitor cells (HSPC). Plays a role in corneal transparency by preventing both blood vessel and lymphatic vessel growth during embryonic development in a VEGF-dependent manner. Involved in chemokine CXCL12-induced endothelial cell migration through the control of CXCR4 expression (By similarity). May function as a tumor suppressor (PubMed:12408963). FOXC1_HUMAN,Q12948",,
HLA-C,"Gene - Major Histocompatibility Complex, Class I, C","HLA-C belongs to the HLA class I heavy chain paralogues. This class I molecule is a heterodimer consisting of a heavy chain and a light chain (beta-2 microglobulin). The heavy chain is anchored in the membrane. Class I molecules play a central role in the immune system by presenting peptides derived from endoplasmic reticulum lumen. They are expressed in nearly all cells. The heavy chain is approximately 45 kDa and its gene contains 8 exons. Exon one encodes the leader peptide, exons 2 and 3 encode the alpha1 and alpha2 domain, which both bind the peptide, exon 4 encodes the alpha3 domain, exon 5 encodes the transmembrane region, and exons 6 and 7 encode the cytoplasmic tail. Polymorphisms within exon 2 and exon 3 are responsible for the peptide binding specificity of each class one molecule. Typing for these polymorphisms is routinely done for bone marrow and kidney transplantation. About 6000 HLA-C alleles have been described. The HLA system plays an important role in the occurrence and outcome of infectious diseases, including those caused by the malaria parasite, the human immunodeficiency virus (HIV), and the severe acute respiratory syndrome coronavirus (SARS-CoV). The structural spike and the nucleocapsid proteins of the novel coronavirus SARS-CoV-2, which causes coronavirus disease 2019 (COVID-19), are reported to contain multiple Class I epitopes with predicted HLA restrictions. Individual HLA genetic variation may help explain different immune responses to a virus across a population.[provided by RefSeq, Aug 2020]","HLA-C (Major Histocompatibility Complex, Class I, C) is a Protein Coding gene. Diseases associated with HLA-C include Psoriasis 1 and Human Immunodeficiency Virus Type 1. Among its related pathways are Class I MHC mediated antigen processing and presentation and SARS-CoV-2 Infection. Gene Ontology (GO) annotations related to this gene include signaling receptor binding and TAP binding. An important paralog of this gene is HLA-B.","Antigen-presenting major histocompatibility complex class I (MHCI) molecule with an important role in reproduction and antiviral immunity (PubMed:20972337, PubMed:24091323, PubMed:20439706, PubMed:11172028, PubMed:20104487, PubMed:28649982, PubMed:29312307). In complex with B2M/beta 2 microglobulin displays a restricted repertoire of self and viral peptides and acts as a dominant ligand for inhibitory and activating killer immunoglobulin receptors (KIRs) expressed on NK cells (PubMed:16141329). In an allogeneic setting, such as during pregnancy, mediates interaction of extravillous trophoblasts with KIR on uterine NK cells and regulate trophoblast invasion necessary for placentation and overall fetal growth (PubMed:20972337, PubMed:24091323). During viral infection, may present viral peptides with low affinity for KIRs, impeding KIR-mediated inhibition through peptide antagonism and favoring lysis of infected cells (PubMed:20439706). Presents a restricted repertoire of viral peptides on antigen-presenting cells for recognition by alpha-beta T cell receptor (TCR) on HLA-C-restricted CD8-positive T cells, guiding antigen-specific T cell immune response to eliminate infected cells, particularly in chronic viral infection settings such as HIV-1 or CMV infection (PubMed:11172028, PubMed:20104487, PubMed:28649982). Both the peptide and the MHC molecule are recognized by TCR, the peptide is responsible for the fine specificity of antigen recognition and MHC residues account for the MHC restriction of T cells (By similarity). Typically presents intracellular peptide antigens of 9 amino acids that arise from cytosolic proteolysis via proteasome. Can bind different peptides containing allele-specific binding motifs, which are mainly defined by anchor residues at position 2 and 9. Preferentially displays peptides having a restricted repertoire of hydrophobic or aromatic amino acids (Phe, Ile, Leu, Met, Val and Tyr) at the C-terminal anchor (PubMed:8265661, PubMed:25311805). HLAC_HUMAN,P10321",,
PRRC2A,Gene - Proline Rich Coiled-Coil 2A,"A cluster of genes, BAT1-BAT5, has been localized in the vicinity of the genes for TNF alpha and TNF beta. These genes are all within the human major histocompatibility complex class III region. This gene has microsatellite repeats which are associated with the age-at-onset of insulin-dependent diabetes mellitus (IDDM) and possibly thought to be involved with the inflammatory process of pancreatic beta-cell destruction during the development of IDDM. This gene is also a candidate gene for the development of rheumatoid arthritis. Two transcript variants encoding the same protein have been found for this gene. [provided by RefSeq, Dec 2010]",PRRC2A (Proline Rich Coiled-Coil 2A) is a Protein Coding gene. Diseases associated with PRRC2A include Phonagnosia and Trichohepatoenteric Syndrome 2. Gene Ontology (GO) annotations related to this gene include RNA binding. An important paralog of this gene is PRRC2C.,"May play a role in the regulation of pre-mRNA splicing. PRC2A_HUMAN,P48634",,
HMGA1,Gene - High Mobility Group AT-Hook 1,"This gene encodes a chromatin-associated protein involved in the regulation of gene transcription, integration of retroviruses into chromosomes, and the metastatic progression of cancer cells. The encoded protein preferentially binds to the minor groove of AT-rich regions in double-stranded DNA. Multiple transcript variants encoding different isoforms have been found for this gene. Pseudogenes of this gene have been identified on multiple chromosomes. [provided by RefSeq, Jan 2016]","HMGA1 (High Mobility Group AT-Hook 1) is a Protein Coding gene. Diseases associated with HMGA1 include Type 2 Diabetes Mellitus and Lipomatosis, Multiple. Among its related pathways are Cellular Senescence and Adipogenesis. Gene Ontology (GO) annotations related to this gene include enzyme binding and nuclear receptor coactivator activity.","HMG-I/Y bind preferentially to the minor groove of A+T rich regions in double-stranded DNA. It is suggested that these proteins could function in nucleosome phasing and in the 3'-end processing of mRNA transcripts. They are also involved in the transcription regulation of genes containing, or in close proximity to A+T-rich regions. HMGA1_HUMAN,P17096",,
VEGFA,Gene - Vascular Endothelial Growth Factor A,"This gene is a member of the PDGF/VEGF growth factor family. It encodes a heparin-binding protein, which exists as a disulfide-linked homodimer. This growth factor induces proliferation and migration of vascular endothelial cells, and is essential for both physiological and pathological angiogenesis. Disruption of this gene in mice resulted in abnormal embryonic blood vessel formation. This gene is upregulated in many known tumors and its expression is correlated with tumor stage and progression. Elevated levels of this protein are found in patients with POEMS syndrome, also known as Crow-Fukase syndrome. Allelic variants of this gene have been associated with microvascular complications of diabetes 1 (MVCD1) and atherosclerosis. Alternatively spliced transcript variants encoding different isoforms have been described. There is also evidence for alternative translation initiation from upstream non-AUG (CUG) codons resulting in additional isoforms. A recent study showed that a C-terminally extended isoform is produced by use of an alternative in-frame translation termination codon via a stop codon readthrough mechanism, and that this isoform is antiangiogenic. Expression of some isoforms derived from the AUG start codon is regulated by a small upstream open reading frame, which is located within an internal ribosome entry site. The levels of VEGF are increased during infection with severe acute respiratory syndrome coronavirus 2 (SARS-CoV-2), thus promoting inflammation by facilitating recruitment of inflammatory cells, and by increasing the level of angiopoietin II (Ang II), one of two products of the SARS-CoV-2 binding target, angiotensin-converting enzyme 2 (ACE2). In turn, Ang II facilitates the elevation of VEGF, thus forming a vicious cycle in the release of inflammatory cytokines. [provided by RefSeq, Jun 2020]",VEGFA (Vascular Endothelial Growth Factor A) is a Protein Coding gene. Diseases associated with VEGFA include Microvascular Complications Of Diabetes 1 and Poems Syndrome. Among its related pathways are Development Beta-adrenergic receptors regulation of ERK and Response to elevated platelet cytosolic Ca2+. Gene Ontology (GO) annotations related to this gene include protein homodimerization activity and protein heterodimerization activity. An important paralog of this gene is PGF.,"Growth factor active in angiogenesis, vasculogenesis and endothelial cell growth. Induces endothelial cell proliferation, promotes cell migration, inhibits apoptosis and induces permeabilization of blood vessels. Binds to the FLT1/VEGFR1 and KDR/VEGFR2 receptors, heparan sulfate and heparin. NRP1/Neuropilin-1 binds isoforms VEGF-165 and VEGF-145. Isoform VEGF165B binds to KDR but does not activate downstream signaling pathways, does not activate angiogenesis and inhibits tumor growth. Binding to NRP1 receptor initiates a signaling pathway needed for motor neuron axon guidance and cell body migration, including for the caudal migration of facial motor neurons from rhombomere 4 to rhombomere 6 during embryonic development (By similarity). Also binds the DEAR/FBXW7-AS1 receptor (PubMed:17446437). VEGFA_HUMAN,P15692",,
LINC02537,Gene - Long Intergenic Non-Protein Coding RNA 2537,,"LINC02537 (Long Intergenic Non-Protein Coding RNA 2537) is an RNA Gene, and is affiliated with the lncRNA class.",,,
HMGCLL1,Gene - 3-Hydroxymethyl-3-Methylglutaryl-CoA Lyase Like 1,"Enables hydroxymethylglutaryl-CoA lyase activity. Involved in ketone body biosynthetic process. Located in several cellular components, including cytosol; endoplasmic reticulum; and perinuclear region of cytoplasm. [provided by Alliance of Genome Resources, Apr 2022]",HMGCLL1 (3-Hydroxymethyl-3-Methylglutaryl-CoA Lyase Like 1) is a Protein Coding gene. Diseases associated with HMGCLL1 include 3-Hydroxy-3-Methylglutaryl-Coa Lyase Deficiency and Alcoholic Ketoacidosis. Among its related pathways are Ketone body metabolism and Branched-chain amino acid catabolism. Gene Ontology (GO) annotations related to this gene include lyase activity and hydroxymethylglutaryl-CoA lyase activity. An important paralog of this gene is HMGCL.,"Non-mitochondrial 3-hydroxymethyl-3-methylglutaryl-CoA lyase that catalyzes a cation-dependent cleavage of (S)-3-hydroxy-3-methylglutaryl-CoA into acetyl-CoA and acetoacetate, a key step in ketogenesis, the products of which support energy production in nonhepatic animal tissues. HMGC2_HUMAN,Q8TB92",,
ARMC2,Gene - Armadillo Repeat Containing 2,"Involved in sperm axoneme assembly. Implicated in spermatogenic failure 38. [provided by Alliance of Genome Resources, Apr 2022]",ARMC2 (Armadillo Repeat Containing 2) is a Protein Coding gene. Diseases associated with ARMC2 include Spermatogenic Failure 38 and Male Infertility With Teratozoospermia Due To Single Gene Mutation. Gene Ontology (GO) annotations related to this gene include binding.,"Required for sperm flagellum axoneme organization and function (By similarity). Involved in axonemal central pair complex assembly and/or stability (By similarity). ARMC2_HUMAN,Q8NEN0",,
RSPO3,Gene - R-Spondin 3,"This gene belongs to the R-spondin family. The encoded protein plays a role in the regulation of Wnt (wingless-type MMTV integration site family)/beta-catenin and Wnt/planar cell polarity (PCP) signaling pathways, which are involved in development, cell growth and disease pathogenesis. Genome-wide association studies suggest a correlation of this gene with bone mineral density and risk of fracture. This gene may be involved in tumor development. [provided by RefSeq, Jul 2013]","RSPO3 (R-Spondin 3) is a Protein Coding gene. Diseases associated with RSPO3 include Tetraamelia Syndrome and Nail Disorder, Nonsyndromic Congenital, 4. Among its related pathways are Gene expression (Transcription) and Regulation of FZD by ubiquitination. Gene Ontology (GO) annotations related to this gene include signaling receptor binding and G protein-coupled receptor binding. An important paralog of this gene is RSPO1.","Activator of the canonical Wnt signaling pathway by acting as a ligand for LGR4-6 receptors, which acts as a key regulator of angiogenesis. Upon binding to LGR4-6 (LGR4, LGR5 or LGR6), LGR4-6 associate with phosphorylated LRP6 and frizzled receptors that are activated by extracellular Wnt receptors, triggering the canonical Wnt signaling pathway to increase expression of target genes. Also regulates the canonical Wnt/beta-catenin-dependent pathway and non-canonical Wnt signaling by acting as an inhibitor of ZNRF3, an important regulator of the Wnt signaling pathway. Acts as a ligand for frizzled FZD8 and LRP6. May negatively regulate the TGF-beta pathway (PubMed:21727895, PubMed:21909076, PubMed:22615920). Acts as a key regulator of angiogenesis by controlling vascular stability and pruning: acts by activating the non-canonical Wnt signaling pathway in endothelial cells (By similarity) (PubMed:21727895, PubMed:21909076, PubMed:22615920). Can also amplify Wnt signaling pathway independently of LGR4-6 receptors, possibly by acting as a direct antagonistic ligand to RNF43 and ZNRF3 (PubMed:29769720). RSPO3_HUMAN,Q9BXY4",,
L3MBTL3,Gene - L3MBTL Histone Methyl-Lysine Binding Protein 3,"This gene encodes a member of the malignant brain tumor (MBT) family of chromatin interacting transcriptional repressors. Members of this family function as methyl-lysine readers, which recognize methylated lysine residues on histone protein tails, and are associated with the repression of gene expression. The encoded protein may regulate hematopoiesis. Homozygous deletion of this gene has been observed in human patients with medulloblastoma. [provided by RefSeq, Oct 2016]",L3MBTL3 (L3MBTL Histone Methyl-Lysine Binding Protein 3) is a Protein Coding gene. Diseases associated with L3MBTL3 include Medulloblastoma. An important paralog of this gene is L3MBTL4.,"Putative Polycomb group (PcG) protein. PcG proteins maintain the transcriptionally repressive state of genes, probably via a modification of chromatin, rendering it heritably changed in its expressibility. Required for normal maturation of myeloid progenitor cells (By similarity). LMBL3_HUMAN,Q96JM7",,
LINC01625,Gene - Long Intergenic Non-Protein Coding RNA 1625,,"LINC01625 (Long Intergenic Non-Protein Coding RNA 1625) is an RNA Gene, and is affiliated with the lncRNA class.",,,
LOC102724152,Gene - Uncharacterized LOC102724152,,"LOC102724152 (Uncharacterized LOC102724152) is an RNA Gene, and is affiliated with the lncRNA class.",,,
