Gene,Description,Entrez Gene,GeneCards,UniProtKB/Swiss-Prot,Tocris,CIViC
SREBF1,Gene - Sterol Regulatory Element Binding Transcription Factor 1,"This gene encodes a basic helix-loop-helix-leucine zipper (bHLH-Zip) transcription factor that binds to the sterol regulatory element-1 (SRE1), which is a motif that is found in the promoter of the low density lipoprotein receptor gene and other genes involved in sterol biosynthesis. The encoded protein is synthesized as a precursor that is initially attached to the nuclear membrane and endoplasmic reticulum. Following cleavage, the mature protein translocates to the nucleus and activates transcription. This cleaveage is inhibited by sterols. This gene is located within the Smith-Magenis syndrome region on chromosome 17. Alternative promoter usage and splicing result in multiple transcript variants, including SREBP-1a and SREBP-1c, which correspond to RefSeq transcript variants 2 and 3, respectively. [provided by RefSeq, Nov 2017]","SREBF1 (Sterol Regulatory Element Binding Transcription Factor 1) is a Protein Coding gene. Diseases associated with SREBF1 include Mucoepithelial Dysplasia, Hereditary and Ifap Syndrome 2. Among its related pathways are Circadian Clock and Adipogenesis. Gene Ontology (GO) annotations related to this gene include DNA-binding transcription factor activity and chromatin binding. An important paralog of this gene is SREBF2.","[Sterol regulatory element-binding protein 1]: Precursor of the transcription factor form (Processed sterol regulatory element-binding protein 1), which is embedded in the endoplasmic reticulum membrane (PubMed:32322062). Low sterol concentrations promote processing of this form, releasing the transcription factor form that translocates into the nucleus and activates transcription of genes involved in cholesterol biosynthesis and lipid homeostasis (By similarity). SRBP1_HUMAN,P36956",,
STARD3,Gene - StAR Related Lipid Transfer Domain Containing 3,"This gene encodes a member of a subfamily of lipid trafficking proteins that are characterized by a C-terminal steroidogenic acute regulatory domain and an N-terminal metastatic lymph node 64 domain. The encoded protein localizes to the membranes of late endosomes and may be involved in exporting cholesterol. Alternative splicing results in multiple transcript variants.[provided by RefSeq, Oct 2009]",STARD3 (StAR Related Lipid Transfer Domain Containing 3) is a Protein Coding gene. Diseases associated with STARD3 include C Syndrome and Lipoid Congenital Adrenal Hyperplasia. Among its related pathways are Cholesterol and Sphingolipids transport / Distribution to the intracellular membrane compartments (normal and CF) and Metabolism of steroid hormones. Gene Ontology (GO) annotations related to this gene include lipid binding and cholesterol transfer activity. An important paralog of this gene is STARD3NL.,"Sterol-binding protein that mediates cholesterol transport from the endoplasmic reticulum to endosomes (PubMed:11053434, PubMed:15930133, PubMed:22514632, PubMed:28377464). Creates contact site between the endoplasmic reticulum and late endosomes: localizes to late endosome membranes and contacts the endoplasmic reticulum via interaction with VAPA and VAPB (PubMed:24105263, PubMed:28377464). Acts as a lipid transfer protein that redirects sterol to the endosome at the expense of the cell membrane and favors membrane formation inside endosomes (PubMed:28377464). May also mediate cholesterol transport between other membranes, such as mitochondria membrane or cell membrane (PubMed:12070139, PubMed:19965586). However, such results need additional experimental evidences; probably mainly mediates cholesterol transport from the endoplasmic reticulum to endosomes (PubMed:28377464). Does not activate transcriptional cholesterol sensing (PubMed:28377464). Able to bind other lipids, such as lutein, a xanthophyll carotenoids that form the macular pigment of the retina (PubMed:21322544). STAR3_HUMAN,Q14849",,
DHX8,Gene - DEAH-Box Helicase 8,"This gene is a member of the DEAH box polypeptide family. The encoded protein contains the DEAH (Asp-Glu-Ala-His) motif which is characteristic of all DEAH box proteins, and is thought to function as an ATP-dependent RNA helicase that regulates the release of spliced mRNAs from spliceosomes prior to their export from the nucleus. This protein may be required for the replication of human immunodeficiency virus type 1 (HIV-1). Alternative splicing results in multiple transcript variants. [provided by RefSeq, Oct 2014]",DHX8 (DEAH-Box Helicase 8) is a Protein Coding gene. Diseases associated with DHX8 include Cakut and Developmental And Epileptic Encephalopathy 23. Among its related pathways are Processing of Capped Intron-Containing Pre-mRNA. Gene Ontology (GO) annotations related to this gene include nucleic acid binding and identical protein binding. An important paralog of this gene is DHX38.,"Involved in pre-mRNA splicing as component of the spliceosome (PubMed:11991638, PubMed:28502770, PubMed:28076346). Facilitates nuclear export of spliced mRNA by releasing the RNA from the spliceosome (PubMed:8608946). DHX8_HUMAN,Q14562",,
LINC00910,Gene - Long Intergenic Non-Protein Coding RNA 910,,"LINC00910 (Long Intergenic Non-Protein Coding RNA 910) is an RNA Gene, and is affiliated with the lncRNA class.",,,
NBR1,Gene - NBR1 Autophagy Cargo Receptor,"The protein encoded by this gene was originally identified as an ovarian tumor antigen monitored in ovarian cancer. The encoded protein contains a B-box/coiled-coil motif, which is present in many genes with transformation potential. It functions as a specific autophagy receptor for the selective autophagic degradation of peroxisomes by forming intracellular inclusions with ubiquitylated autophagic substrates. This gene is located on a region of chromosome 17q21.1 that is in close proximity to the BRCA1 tumor suppressor gene. Alternative splicing of this gene results in multiple transcript variants. [provided by RefSeq, Apr 2014]","NBR1 (NBR1 Autophagy Cargo Receptor) is a Protein Coding gene. Diseases associated with NBR1 include Brooke-Spiegler Syndrome and Myopathy, Myofibrillar, 9, With Early Respiratory Failure. Among its related pathways are Selective autophagy. Gene Ontology (GO) annotations related to this gene include ubiquitin binding and mitogen-activated protein kinase binding.","Acts probably as a receptor for selective autophagosomal degradation of ubiquitinated targets. NBR1_HUMAN,Q14596",,
TUBD1,Gene - Tubulin Delta 1,"Predicted to enable GTP binding activity. Predicted to be a structural constituent of cytoskeleton. Predicted to be involved in microtubule cytoskeleton organization; mitotic cell cycle; and positive regulation of smoothened signaling pathway. Located in cytosol and nucleoplasm. [provided by Alliance of Genome Resources, Apr 2022]",TUBD1 (Tubulin Delta 1) is a Protein Coding gene. Diseases associated with TUBD1 include Seckel Syndrome 7 and Cone-Rod Dystrophy 20. Among its related pathways are ERK Signaling and PAK Pathway. Gene Ontology (GO) annotations related to this gene include GTP binding and structural constituent of cytoskeleton. An important paralog of this gene is TUBE1.,"Acts as a positive regulator of hedgehog signaling and regulates ciliary function. TBD_HUMAN,Q9UJT1","Microtubules are cylindrical tubes of 20-25 nm in diameter. They are composed of protofilaments which are in turn composed of alpha- and beta-tubulin polymers. Each microtubule is polarized; at one end alpha-subunits are exposed (-) and at the other, beta-subunits are exposed (+).",
APOH,Gene - Apolipoprotein H,"Apolipoprotein H, also known as beta-2-glycoprotein I, is a component of circulating plasma lipoproteins. It has been implicated in a variety of physiologic pathways including lipoprotein metabolism, coagulation, hemostasis, and the production of antiphospholipid autoantibodies. APOH may be a required cofactor for anionic phospholipid binding by the antiphospholipid autoantibodies found in sera of many patients with lupus and primary antiphospholipid syndrome (APS). The anti-beta (2) glycoprotein I antibodies from APS patients, mediate inhibition of activated protein C which has anticoagulant properties. Because beta-2-GPI is the main autoantigen in patients with APS, the disruption of this pathway by autoantibodies may be an important mechanism for thrombosis in patients with APS.[provided by RefSeq, Dec 2019]",APOH (Apolipoprotein H) is a Protein Coding gene. Diseases associated with APOH include Antiphospholipid Syndrome and Syphilis. Among its related pathways are Response to elevated platelet cytosolic Ca2+. Gene Ontology (GO) annotations related to this gene include identical protein binding and heparin binding. An important paralog of this gene is CR2.,"Binds to various kinds of negatively charged substances such as heparin, phospholipids, and dextran sulfate. May prevent activation of the intrinsic blood coagulation cascade by binding to phospholipids on the surface of damaged cells. APOH_HUMAN,P02749",,
BPTF,Gene - Bromodomain PHD Finger Transcription Factor,"This gene was identified by the reactivity of its encoded protein to a monoclonal antibody prepared against brain homogenates from patients with Alzheimer's disease. Analysis of the original protein (fetal Alz-50 reactive clone 1, or FAC1), identified as an 810 aa protein containing a DNA-binding domain and a zinc finger motif, suggested it might play a role in the regulation of transcription. High levels of FAC1 were detected in fetal brain and in patients with neurodegenerative diseases. The protein encoded by this gene is actually much larger than originally thought, and it also contains a C-terminal bromodomain characteristic of proteins that regulate transcription during proliferation. The encoded protein is highly similar to the largest subunit of the Drosophila NURF (nucleosome remodeling factor) complex. In Drosophila, the NURF complex, which catalyzes nucleosome sliding on DNA and interacts with sequence-specific transcription factors, is necessary for the chromatin remodeling required for transcription. Two alternative transcripts encoding different isoforms have been described completely. [provided by RefSeq, Jul 2008]",BPTF (Bromodomain PHD Finger Transcription Factor) is a Protein Coding gene. Diseases associated with BPTF include Neurodevelopmental Disorder With Dysmorphic Facies And Distal Limb Anomalies and Autism. Among its related pathways are Endoderm differentiation and 16p11.2 proximal deletion syndrome. Gene Ontology (GO) annotations related to this gene include sequence-specific DNA binding and transcription factor binding. An important paralog of this gene is BAZ2B.,"Regulatory subunit of the ATP-dependent NURF-1 and NURF-5 ISWI chromatin remodeling complexes, which form ordered nucleosome arrays on chromatin and facilitate access to DNA during DNA-templated processes such as DNA replication, transcription, and repair (PubMed:14609955, PubMed:28801535). The NURF-1 ISWI chromatin remodeling complex has a lower ATP hydrolysis rate than the NURF-5 ISWI chromatin remodeling complex (PubMed:28801535). Within the NURF-1 ISWI chromatin-remodeling complex, binds to the promoters of En1 and En2 to positively regulate their expression and promote brain development (PubMed:14609955). Histone-binding protein which binds to H3 tails trimethylated on 'Lys-4' (H3K4me3), which mark transcription start sites of active genes (PubMed:16728976, PubMed:16728978). Binds to histone H3 tails dimethylated on 'Lys-4' (H3K4Me2) to a lesser extent (PubMed:16728976, PubMed:16728978, PubMed:18042461). May also regulate transcription through direct binding to DNA or transcription factors (PubMed:10575013). BPTF_HUMAN,Q12830",,
KCNJ2,Gene - Potassium Inwardly Rectifying Channel Subfamily J Member 2,"Potassium channels are present in most mammalian cells, where they participate in a wide range of physiologic responses. The protein encoded by this gene is an integral membrane protein and inward-rectifier type potassium channel. The encoded protein, which has a greater tendency to allow potassium to flow into a cell rather than out of a cell, probably participates in establishing action potential waveform and excitability of neuronal and muscle tissues. Mutations in this gene have been associated with Andersen syndrome, which is characterized by periodic paralysis, cardiac arrhythmias, and dysmorphic features. [provided by RefSeq, Jul 2008]",KCNJ2 (Potassium Inwardly Rectifying Channel Subfamily J Member 2) is a Protein Coding gene. Diseases associated with KCNJ2 include Andersen Cardiodysrhythmic Periodic Paralysis and Short Qt Syndrome 3. Among its related pathways are Olfactory Signaling Pathway and Sensory perception of taste. Gene Ontology (GO) annotations related to this gene include identical protein binding and inward rectifier potassium channel activity. An important paralog of this gene is KCNJ12.,"Probably participates in establishing action potential waveform and excitability of neuronal and muscle tissues. Inward rectifier potassium channels are characterized by a greater tendency to allow potassium to flow into the cell rather than out of it. Their voltage dependence is regulated by the concentration of extracellular potassium; as external potassium is raised, the voltage range of the channel opening shifts to more positive voltages. The inward rectification is mainly due to the blockage of outward current by internal magnesium. Can be blocked by extracellular barium or cesium. KCNJ2_HUMAN,P63252","The inward-rectifier potassium channel family (also known as 2-TM channels) include the strong inward-rectifier channels (Kir2.x), the G-protein-activated inward-rectifier channels (Kir3.x) and the ATP-sensitive channels (Kir6.x), which combine with sulphonylurea receptors.",
LINC02003,Gene - Long Intergenic Non-Protein Coding RNA 2003,,"LINC02003 (Long Intergenic Non-Protein Coding RNA 2003) is an RNA Gene, and is affiliated with the lncRNA class.",,,
EMILIN2,Gene - Elastin Microfibril Interfacer 2,"Predicted to enable extracellular matrix constituent conferring elasticity. Predicted to be involved in cell adhesion. Located in extracellular region. [provided by Alliance of Genome Resources, Apr 2022]",EMILIN2 (Elastin Microfibril Interfacer 2) is a Protein Coding gene. Diseases associated with EMILIN2 include Porokeratosis and Arteriovenous Malformation. Among its related pathways are Elastic fibre formation and Extracellular matrix organization. Gene Ontology (GO) annotations related to this gene include extracellular matrix constituent conferring elasticity. An important paralog of this gene is EMILIN1.,"May be responsible for anchoring smooth muscle cells to elastic fibers, and may be involved not only in the formation of the elastic fiber, but also in the processes that regulate vessel assembly. Has cell adhesive capacity. EMIL2_HUMAN,Q9BXX0",,
CTAGE1,Gene - Cutaneous T Cell Lymphoma-Associated Antigen 1,"Predicted to be involved in endoplasmic reticulum to Golgi vesicle-mediated transport; protein secretion; and vesicle cargo loading. Predicted to be integral component of membrane. Predicted to be active in endoplasmic reticulum exit site and endoplasmic reticulum membrane. [provided by Alliance of Genome Resources, Apr 2022]",CTAGE1 (Cutaneous T Cell Lymphoma-Associated Antigen 1) is a Protein Coding gene. Diseases associated with CTAGE1 include Lymphoma and Meckel's Diverticulitis. An important paralog of this gene is MIA2.,,,
GATA6,Gene - GATA Binding Protein 6,"This gene is a member of a small family of zinc finger transcription factors that play an important role in the regulation of cellular differentiation and organogenesis during vertebrate development. This gene is expressed during early embryogenesis and localizes to endo- and mesodermally derived cells during later embryogenesis and thereby plays an important role in gut, lung, and heart development. Mutations in this gene are associated with several congenital defects. [provided by RefSeq, Mar 2012]","GATA6 (GATA Binding Protein 6) is a Protein Coding gene. Diseases associated with GATA6 include Heart Defects, Congenital, And Other Congenital Anomalies and Atrioventricular Septal Defect 5. Among its related pathways are Ectoderm differentiation and Response to elevated platelet cytosolic Ca2+. Gene Ontology (GO) annotations related to this gene include DNA-binding transcription factor activity and chromatin binding. An important paralog of this gene is GATA4.","Transcriptional activator (PubMed:19666519, PubMed:27756709, PubMed:22750565, PubMed:22824924). Regulates SEMA3C and PLXNA2 (PubMed:19666519). Involved in gene regulation specifically in the gastric epithelium (PubMed:9315713). May regulate genes that protect epithelial cells from bacterial infection (PubMed:16968778). Involved in bone morphogenetic protein (BMP)-mediated cardiac-specific gene expression (By similarity). Binds to BMP response element (BMPRE) DNA sequences within cardiac activating regions (By similarity). In human skin, controls several physiological processes contributing to homeostasis of the upper pilosebaceous unit. Triggers ductal and sebaceous differentiation as well as limits cell proliferation and lipid production to prevent hyperseborrhoea. Mediates the effects of retinoic acid on sebocyte proliferation, differentiation and lipid production. Also contributes to immune regulation of sebocytes and antimicrobial responses by modulating the expression of anti-inflammatory genes such as IL10 and pro-inflammatory genes such as IL6, TLR2, TLR4, and IFNG. Activates TGFB1 signaling which controls the interfollicular epidermis fate (PubMed:33082341). GATA6_HUMAN,Q92908",,
RMC1,Gene - Regulator Of MON1-CCZ1,"This gene encodes a colon cancer associated protein. [provided by RefSeq, Jan 2013]",RMC1 (Regulator Of MON1-CCZ1) is a Protein Coding gene. Diseases associated with RMC1 include Retinal Vascular Disease and Exudative Vitreoretinopathy 1.,"Componement of the CCZ1-MON1 RAB7A guanine exchange factor (GEF). Acts as a positive regulator of CCZ1-MON1A/B function necessary for endosomal/autophagic flux and efficient RAB7A localization (PubMed:29038162). RMC1_HUMAN,Q96DM3",,
PMAIP1,Gene - Phorbol-12-Myristate-13-Acetate-Induced Protein 1,"This gene belongs to a pro-apoptotic subfamily within the BCL-2 protein family, referred to as the BCL-2 homology domain 3 (BH3)-only subfamily, which determine whether a cell commits to apoptosis. In response to death-inducing stimuli, BH3-only members inhibit the anti-apoptotic BCL-2 family members, which under steady-state conditions keep the multi-BH domain proteins BAX and BAK, in an inactive state. [provided by RefSeq, Aug 2020]",PMAIP1 (Phorbol-12-Myristate-13-Acetate-Induced Protein 1) is a Protein Coding gene. Diseases associated with PMAIP1 include Mantle Cell Lymphoma and Colorectal Cancer. Among its related pathways are Gene expression (Transcription) and Validated targets of C-MYC transcriptional activation.,"Promotes activation of caspases and apoptosis. Promotes mitochondrial membrane changes and efflux of apoptogenic proteins from the mitochondria. Contributes to p53/TP53-dependent apoptosis after radiation exposure. Promotes proteasomal degradation of MCL1. Competes with BAK1 for binding to MCL1 and can displace BAK1 from its binding site on MCL1 (By similarity). Competes with BIM/BCL2L11 for binding to MCL1 and can displace BIM/BCL2L11 from its binding site on MCL1. APR_HUMAN,Q13794",,
BCL2,Gene - BCL2 Apoptosis Regulator,"This gene encodes an integral outer mitochondrial membrane protein that blocks the apoptotic death of some cells such as lymphocytes. Constitutive expression of BCL2, such as in the case of translocation of BCL2 to Ig heavy chain locus, is thought to be the cause of follicular lymphoma. Alternative splicing results in multiple transcript variants. [provided by RefSeq, Feb 2016]",BCL2 (BCL2 Apoptosis Regulator) is a Protein Coding gene. Diseases associated with BCL2 include Follicular Lymphoma and High-Grade B-Cell Lymphoma Double-Hit/Triple-Hit. Among its related pathways are MIF Mediated Glucocorticoid Regulation and Overview of nanoparticle effects. Gene Ontology (GO) annotations related to this gene include protein homodimerization activity and identical protein binding. An important paralog of this gene is BCL2L1.,"Suppresses apoptosis in a variety of cell systems including factor-dependent lymphohematopoietic and neural cells (PubMed:1508712, PubMed:8183370). Regulates cell death by controlling the mitochondrial membrane permeability (PubMed:11368354). Appears to function in a feedback loop system with caspases (PubMed:11368354). Inhibits caspase activity either by preventing the release of cytochrome c from the mitochondria and/or by binding to the apoptosis-activating factor (APAF-1) (PubMed:11368354). Also acts as an inhibitor of autophagy: interacts with BECN1 and AMBRA1 during non-starvation conditions and inhibits their autophagy function (PubMed:18570871, PubMed:21358617, PubMed:20889974). May attenuate inflammation by impairing NLRP1-inflammasome activation, hence CASP1 activation and IL1B release (PubMed:17418785). BCL2_HUMAN,P10415","Bcl-2 family proteins contribute to programmed cell death or apoptosis. It is a large protein family and all members contain at least one of four Bcl-2 homology domains. Certain members (Bcl-2, Bcl-XL and Mcl-1) are antiapoptotic, whilst others (Bax, Bak, Bok) are proapoptotic.",
