Gene,Description,Entrez Gene,GeneCards,UniProtKB/Swiss-Prot,Tocris,CIViC
AKNA,Gene - AT-Hook Transcription Factor,"Predicted to enable DNA binding activity. Involved in positive regulation of transcription by RNA polymerase II. Located in centrosome; cytosol; and nuclear lumen. [provided by Alliance of Genome Resources, Apr 2022]","AKNA (AT-Hook Transcription Factor) is a Protein Coding gene. Diseases associated with AKNA include Primary Ciliary Dyskinesia and Microcephaly. Gene Ontology (GO) annotations related to this gene include RNA polymerase II cis-regulatory region sequence-specific DNA binding and DNA-binding transcription activator activity, RNA polymerase II-specific. An important paralog of this gene is AKNAD1.","Centrosomal protein that plays a key role in cell delamination by regulating microtubule organization (By similarity). Required for the delamination and retention of neural stem cells from the subventricular zone during neurogenesis (By similarity). Also regulates the epithelial-to-mesenchymal transition in other epithelial cells (By similarity). Acts by increasing centrosomal microtubule nucleation and recruiting nucleation factors and minus-end stabilizers, thereby destabilizing microtubules at the adherens junctions and mediating constriction of the apical endfoot (By similarity). In addition, may also act as a transcription factor that specifically activates the expression of the CD40 receptor and its ligand CD40L/CD154, two cell surface molecules on lymphocytes that are critical for antigen-dependent-B-cell development (PubMed:11268217). Binds to A/T-rich promoters (PubMed:11268217). It is unclear how it can both act as a microtubule organizer and as a transcription factor; additional evidences are required to reconcile these two apparently contradictory functions (Probable). AKNA_HUMAN,Q7Z591",,
JMJD1C,Gene - Jumonji Domain Containing 1C,"The protein encoded by this gene interacts with thyroid hormone receptors and contains a jumonji domain. It is a candidate histone demethylase and is thought to be a coactivator for key transcription factors. It plays a role in the DNA-damage response pathway by demethylating the mediator of DNA damage checkpoint 1 (MDC1) protein, and is required for the survival of acute myeloid leukemia. Mutations in this gene are associated with Rett syndrome and intellectual disability. Alternative splicing results in multiple transcript variants. [provided by RefSeq, Dec 2015]","JMJD1C (Jumonji Domain Containing 1C) is a Protein Coding gene. Diseases associated with JMJD1C include Central Nervous System Germinoma and Chromosome 22Q11.2 Deletion Syndrome, Distal. Among its related pathways are Response to elevated platelet cytosolic Ca2+ and Pathways affected in adenoid cystic carcinoma. Gene Ontology (GO) annotations related to this gene include nuclear thyroid hormone receptor binding and dioxygenase activity. An important paralog of this gene is KDM3B.","Probable histone demethylase that specifically demethylates 'Lys-9' of histone H3, thereby playing a central role in histone code. Demethylation of Lys residue generates formaldehyde and succinate. May be involved in hormone-dependent transcriptional activation, by participating in recruitment to androgen-receptor target genes (By similarity). JHD2C_HUMAN,Q15652",,
PTEN,Gene - Phosphatase And Tensin Homolog,"This gene was identified as a tumor suppressor that is mutated in a large number of cancers at high frequency. The protein encoded by this gene is a phosphatidylinositol-3,4,5-trisphosphate 3-phosphatase. It contains a tensin like domain as well as a catalytic domain similar to that of the dual specificity protein tyrosine phosphatases. Unlike most of the protein tyrosine phosphatases, this protein preferentially dephosphorylates phosphoinositide substrates. It negatively regulates intracellular levels of phosphatidylinositol-3,4,5-trisphosphate in cells and functions as a tumor suppressor by negatively regulating AKT/PKB signaling pathway. The use of a non-canonical (CUG) upstream initiation site produces a longer isoform that initiates translation with a leucine, and is thought to be preferentially associated with the mitochondrial inner membrane. This longer isoform may help regulate energy metabolism in the mitochondria. A pseudogene of this gene is found on chromosome 9. Alternative splicing and the use of multiple translation start codons results in multiple transcript variants encoding different isoforms. [provided by RefSeq, Feb 2015]",PTEN (Phosphatase And Tensin Homolog) is a Protein Coding gene. Diseases associated with PTEN include Cowden Syndrome 1 and Macrocephaly/Autism Syndrome. Among its related pathways are PI3K / Akt Signaling and Breast cancer pathway. Gene Ontology (GO) annotations related to this gene include protein kinase binding and magnesium ion binding. An important paralog of this gene is TPTE2.,"Tumor suppressor. Acts as a dual-specificity protein phosphatase, dephosphorylating tyrosine-, serine- and threonine-phosphorylated proteins. Also acts as a lipid phosphatase, removing the phosphate in the D3 position of the inositol ring from phosphatidylinositol 3,4,5-trisphosphate, phosphatidylinositol 3,4-diphosphate, phosphatidylinositol 3-phosphate and inositol 1,3,4,5-tetrakisphosphate with order of substrate preference in vitro PtdIns(3,4,5)P3 > PtdIns(3,4)P2 > PtdIns3P > Ins(1,3,4,5)P4 (PubMed:26504226, PubMed:16824732). The lipid phosphatase activity is critical for its tumor suppressor function. Antagonizes the PI3K-AKT/PKB signaling pathway by dephosphorylating phosphoinositides and thereby modulating cell cycle progression and cell survival. The unphosphorylated form cooperates with MAGI2 to suppress AKT1 activation. Dephosphorylates tyrosine-phosphorylated focal adhesion kinase and inhibits cell migration and integrin-mediated cell spreading and focal adhesion formation. Plays a role as a key modulator of the AKT-mTOR signaling pathway controlling the tempo of the process of newborn neurons integration during adult neurogenesis, including correct neuron positioning, dendritic development and synapse formation. May be a negative regulator of insulin signaling and glucose metabolism in adipose tissue. The nuclear monoubiquitinated form possesses greater apoptotic potential, whereas the cytoplasmic nonubiquitinated form induces less tumor suppressive ability. In motile cells, suppresses the formation of lateral pseudopods and thereby promotes cell polarization and directed movement. PTEN_HUMAN,P60484",,"PTEN is a multi-functional tumor suppressor that is very commonly lost in human cancer. Observed in prostate cancer, glioblastoma, endometrial, lung and breast cancer to varying degrees. Up to 70% of prostate cancer patients have been observed to have loss of expression of the gene. It is a part of the PI3K/AKT/mTOR pathway and mTOR inhibitors have been relatively ineffective in treating patients with PTEN loss. New appoaches using microRNAs are currently being investigated."
GPAM,"Gene - Glycerol-3-Phosphate Acyltransferase, Mitochondrial","This gene encodes a mitochondrial enzyme which prefers saturated fatty acids as its substrate for the synthesis of glycerolipids. This metabolic pathway's first step is catalyzed by the encoded enzyme. Two forms for this enzyme exist, one in the mitochondria and one in the endoplasmic reticulum. Two alternatively spliced transcript variants have been described for this gene. [provided by RefSeq, Oct 2011]","GPAM (Glycerol-3-Phosphate Acyltransferase, Mitochondrial) is a Protein Coding gene. Diseases associated with GPAM include Body Mass Index Quantitative Trait Locus 11 and Congenital Generalized Lipodystrophy. Among its related pathways are Glycerophospholipid biosynthetic pathway and Gene expression (Transcription). Gene Ontology (GO) annotations related to this gene include acyltransferase activity and glycerol-3-phosphate O-acyltransferase activity. An important paralog of this gene is GPAT2.","Esterifies acyl-group from acyl-ACP to the sn-1 position of glycerol-3-phosphate, an essential step in glycerolipids biosynthesis such as triglycerides, phosphatidic acids and lysophosphatidic acids. GPAT1_HUMAN,Q9HCL2",,
FGFR2,Gene - Fibroblast Growth Factor Receptor 2,"The protein encoded by this gene is a member of the fibroblast growth factor receptor family, where amino acid sequence is highly conserved between members and throughout evolution. FGFR family members differ from one another in their ligand affinities and tissue distribution. A full-length representative protein consists of an extracellular region, composed of three immunoglobulin-like domains, a single hydrophobic membrane-spanning segment and a cytoplasmic tyrosine kinase domain. The extracellular portion of the protein interacts with fibroblast growth factors, setting in motion a cascade of downstream signals, ultimately influencing mitogenesis and differentiation. This particular family member is a high-affinity receptor for acidic, basic and/or keratinocyte growth factor, depending on the isoform. Mutations in this gene are associated with Crouzon syndrome, Pfeiffer syndrome, Craniosynostosis, Apert syndrome, Jackson-Weiss syndrome, Beare-Stevenson cutis gyrata syndrome, Saethre-Chotzen syndrome, and syndromic craniosynostosis. Multiple alternatively spliced transcript variants encoding different isoforms have been noted for this gene. [provided by RefSeq, Jan 2009]",FGFR2 (Fibroblast Growth Factor Receptor 2) is a Protein Coding gene. Diseases associated with FGFR2 include Pfeiffer Syndrome and Crouzon Syndrome. Among its related pathways are Ectoderm differentiation and GPCR Pathway. Gene Ontology (GO) annotations related to this gene include protein homodimerization activity and protein kinase activity. An important paralog of this gene is FGFR1.,"Tyrosine-protein kinase that acts as cell-surface receptor for fibroblast growth factors and plays an essential role in the regulation of cell proliferation, differentiation, migration and apoptosis, and in the regulation of embryonic development. Required for normal embryonic patterning, trophoblast function, limb bud development, lung morphogenesis, osteogenesis and skin development. Plays an essential role in the regulation of osteoblast differentiation, proliferation and apoptosis, and is required for normal skeleton development. Promotes cell proliferation in keratinocytes and immature osteoblasts, but promotes apoptosis in differentiated osteoblasts. Phosphorylates PLCG1, FRS2 and PAK4. Ligand binding leads to the activation of several signaling cascades. Activation of PLCG1 leads to the production of the cellular signaling molecules diacylglycerol and inositol 1,4,5-trisphosphate. Phosphorylation of FRS2 triggers recruitment of GRB2, GAB1, PIK3R1 and SOS1, and mediates activation of RAS, MAPK1/ERK2, MAPK3/ERK1 and the MAP kinase signaling pathway, as well as of the AKT1 signaling pathway. FGFR2 signaling is down-regulated by ubiquitination, internalization and degradation. Mutations that lead to constitutive kinase activation or impair normal FGFR2 maturation, internalization and degradation lead to aberrant signaling. Over-expressed FGFR2 promotes activation of STAT1. FGFR2_HUMAN,P21802","Fibroblast growth factors (FGFs) are mitogenic signaling molecules that have roles in angiogenesis, wound healing, cell migration, neural outgrowth and embryonic development. FGF receptors (FGFRs) are transmembrane catalytic receptors with intracellular tyrosine kinase activity.","The FGFR proteins are involved in a wide array of pathways known to play a signficant role in cancer. Activation of these receptors can lead to activation of the RAS-MAPK pathway and the PI3K-AKT pathway, among others. The mechanisms by which FGFR can be misregulated vary between cancers. Amplification of the receptors has been observed in lung and breast cancers, coding mutations and deletions have been seen in many cancers, and more recently, FGFR fusions that lead to pathway actiation have been demonstrated to have oncogenic potential across multiple cancer types. The targeted therapeutics ponatinib, dovitinib and pazopanib have seen success in treating over-active FGFR signalling, prompting use of diagnostic sequencing targeting the FGFR genes, especially in lung cancer patients."
MRVI1,"Gene - Inositol 1,4,5-Triphosphate Receptor Associated 1","This gene is similar to a putative mouse tumor suppressor gene (Mrvi1) that is frequently disrupted by mouse AIDS-related virus (MRV). The encoded protein, which is found in the membrane of the endoplasmic reticulum, is similar to Jaw1, a lymphoid-restricted protein whose expression is down-regulated during lymphoid differentiation. This protein is a substrate of cGMP-dependent kinase-1 (PKG1) that can function as a regulator of IP3-induced calcium release. Studies in mouse suggest that MRV integration at Mrvi1 induces myeloid leukemia by altering the expression of a gene important for myeloid cell growth and/or differentiation, and thus this gene may function as a myeloid leukemia tumor suppressor gene. Several alternatively spliced transcript variants encoding different isoforms have been found for this gene, and alternative translation start sites, including a non-AUG (CUG) start site, are used. [provided by RefSeq, May 2011]","IRAG1 (Inositol 1,4,5-Triphosphate Receptor Associated 1) is a Protein Coding gene. Diseases associated with IRAG1 include Achalasia and Retinitis Pigmentosa 4. Among its related pathways are Response to elevated platelet cytosolic Ca2+ and Nitric oxide stimulates guanylate cyclase. An important paralog of this gene is IRAG2.","Plays a role as NO/PRKG1-dependent regulator of IP3-induced calcium release; its phosphorylation by PRKG1 inhibits bradykinin and IP3-induced calcium release from intracellular stores. Recruits PRKG1 to the endoplasmic reticulum and may mediate the assembly of PRKG1 and ITPR1 in a macrocomplex. Involved in PRKG1 signaling cascade leading to inhibition of platelet activation and aggregation. Mediates also NO-dependent inhibition of calcium signaling in gastrointestinal smooth muscle contributing to NO-dependent relaxation. IRAG1_HUMAN,Q9Y6F6",,
PDE3B,Gene - Phosphodiesterase 3B,"Enables 3',5'-cyclic-nucleotide phosphodiesterase activity. Involved in negative regulation of angiogenesis; negative regulation of cell adhesion; and negative regulation of lipid catabolic process. Located in membrane. Part of guanyl-nucleotide exchange factor complex. [provided by Alliance of Genome Resources, Apr 2022]","PDE3B (Phosphodiesterase 3B) is a Protein Coding gene. Diseases associated with PDE3B include Pseudohypoparathyroidism, Type Ii and Pelizaeus-Merzbacher Disease. Among its related pathways are Development Beta-adrenergic receptors regulation of ERK and Signaling by Receptor Tyrosine Kinases. Gene Ontology (GO) annotations related to this gene include 3',5'-cyclic-nucleotide phosphodiesterase activity and cGMP-inhibited cyclic-nucleotide phosphodiesterase activity. An important paralog of this gene is PDE3A.","Cyclic nucleotide phosphodiesterase with a dual-specificity for the second messengers cAMP and cGMP, which are key regulators of many important physiological processes. May play a role in fat metabolism. Regulates cAMP binding of RAPGEF3. Through simultaneous binding to RAPGEF3 and PIK3R6 assembles a signaling complex in which the PI3K gamma complex is activated by RAPGEF3 and which is involved in angiogenesis. PDE3B_HUMAN,Q13370","Phosphodiesterases (PDEs) are a family of phosphohydrolyases that catalyze the hydrolysis of 3' cyclic phosphate bonds in adenosine and/or guanine 3',5' cyclic monophosphate (cAMP and/or cGMP). PDEs regulate the second messengers by controlling their degradation.",
ANO3,Gene - Anoctamin 3,"The protein encoded by this gene belongs to the TMEM16 family of predicted membrane proteins, that are also known as anoctamins. While little is known about the function of this gene, mutations in this gene have been associated with some cases of autosomal dominant craniocervical dystonia. Cells from individuals with a mutation in this gene exhibited abnormalities in endoplasmic reticulum-dependent calcium signaling. Studies in rat show that the rat ortholog of this protein interacts with, and modulates the activity of a sodium-activated potassium channel. Deletion of this gene caused increased pain sensitivity in the rat model system. Alternative splicing results in multiple transcript variants encoding different isoforms. [provided by RefSeq, Aug 2015]",ANO3 (Anoctamin 3) is a Protein Coding gene. Diseases associated with ANO3 include Dystonia 24 and Dystonia. Among its related pathways are Ion channel transport and Transport of inorganic cations/anions and amino acids/oligopeptides. Gene Ontology (GO) annotations related to this gene include intracellular calcium activated chloride channel activity and phospholipid scramblase activity. An important paralog of this gene is ANO4.,"Has calcium-dependent phospholipid scramblase activity; scrambles phosphatidylcholine and galactosylceramide (By similarity). Seems to act as potassium channel regulator and may inhibit pain signaling; can facilitate KCNT1/Slack channel activity by promoting its full single-channel conductance at very low sodium concentrations and by increasing its sodium sensitivity (By similarity). Does not exhibit calcium-activated chloride channel (CaCC) activity (PubMed:21984732). ANO3_HUMAN,Q9BYT9",,
MTCH2,Gene - Mitochondrial Carrier 2,"This gene encodes a member of the SLC25 family of nuclear-encoded transporters that are localized in the inner mitochondrial membrane. Members of this superfamily are involved in many metabolic pathways and cell functions. Genome-wide association studies in human have identified single-nucleotide polymorphisms in several loci associated with obesity. This gene is one such locus, which is highly expressed in white adipose tissue and adipocytes, and thought to play a regulatory role in adipocyte differentiation and biology. Alternatively spliced transcript variants encoding different isoforms have been found for this gene. A recent study showed this gene to be an authentic stop codon readthrough target that can produce two isoforms from the same mRNA by use of alternative in-frame translation termination codons. [provided by RefSeq, Dec 2017]",MTCH2 (Mitochondrial Carrier 2) is a Protein Coding gene. Diseases associated with MTCH2 include Combined Thymoma and Type 2 Diabetes Mellitus. An important paralog of this gene is MTCH1.,"Plays important roles in regulating apoptosis, metabolism and mitochondrial dynamics. MTCH2 acts as a receptor for the truncated form of pro-apoptotic BH3-interacting domain death agonist (p15 BID) and has therefore a critical function in apoptosis. Plays a critical role in controlling the quiescence/cycling of hematopoietic stem cells (HSCs). Acts as a regulator of mitochondrial fusion, essential for the naive-to-primed interconversion of embryonic stem cells (ESCs). Acts as a regulator of lipid homeostasis and has a regulatory role in adipocyte differentiation and biology. MTCH2_HUMAN,Q9Y6C9",,
VEGFB,Gene - Vascular Endothelial Growth Factor B,"This gene encodes a member of the PDGF (platelet-derived growth factor)/VEGF (vascular endothelial growth factor) family. The VEGF family members regulate the formation of blood vessels and are involved in endothelial cell physiology. This member is a ligand for VEGFR-1 (vascular endothelial growth factor receptor 1) and NRP-1 (neuropilin-1). Studies in mice showed that this gene was co-expressed with nuclear-encoded mitochondrial genes and the encoded protein specifically controlled endothelial uptake of fatty acids. Alternatively spliced transcript variants encoding distinct isoforms have been identified. [provided by RefSeq, Sep 2011]","VEGFB (Vascular Endothelial Growth Factor B) is a Protein Coding gene. Diseases associated with VEGFB include Macular Degeneration, Age-Related, 1 and Blood Group, Globoside System. Among its related pathways are GPCR Pathway and Response to elevated platelet cytosolic Ca2+. Gene Ontology (GO) annotations related to this gene include protein homodimerization activity and growth factor activity. An important paralog of this gene is VEGFA.","Growth factor for endothelial cells. VEGF-B167 binds heparin and neuropilin-1 whereas the binding to neuropilin-1 of VEGF-B186 is regulated by proteolysis. VEGFB_HUMAN,P49765",,
ZC3H12C,Gene - Zinc Finger CCCH-Type Containing 12C,"Predicted to enable endoribonuclease activity and mRNA binding activity. Predicted to be involved in RNA phosphodiester bond hydrolysis, endonucleolytic. Predicted to be active in cytoplasmic ribonucleoprotein granule and nucleus. [provided by Alliance of Genome Resources, Apr 2022]",ZC3H12C (Zinc Finger CCCH-Type Containing 12C) is a Protein Coding gene. Diseases associated with ZC3H12C include Entropion. Gene Ontology (GO) annotations related to this gene include endonuclease activity. An important paralog of this gene is ZC3H12B.,"May function as RNase and regulate the levels of target RNA species. ZC12C_HUMAN,Q9C0D7",,
MIR100HG,Gene - Mir-100-Let-7a-2-Mir-125b-1 Cluster Host Gene,"This gene produces long non-coding RNAs that act as regulators of cell proliferation. Alternative promoter usage and splicing results in multiple transcript variants. Some transcript variants may promote growth, while others may act to negatively regulate cell division. [provided by RefSeq, May 2016]","MIR100HG (Mir-100-Let-7a-2-Mir-125b-1 Cluster Host Gene) is an RNA Gene, and is affiliated with the lncRNA class. Diseases associated with MIR100HG include Myeloid Leukemia and Myopia.",,,
PDE3A,Gene - Phosphodiesterase 3A,"This gene encodes a member of the cGMP-inhibited cyclic nucleotide phosphodiesterase (cGI-PDE) family. cGI-PDE enzymes hydrolyze both cAMP and cGMP, and play critical roles in many cellular processes by regulating the amplitude and duration of intracellular cyclic nucleotide signals. The encoded protein mediates platelet aggregation and also plays important roles in cardiovascular function by regulating vascular smooth muscle contraction and relaxation. Inhibitors of the encoded protein may be effective in treating congestive heart failure. Alternatively spliced transcript variants encoding multiple isoforms have been observed for this gene. [provided by RefSeq, Sep 2011]","PDE3A (Phosphodiesterase 3A) is a Protein Coding gene. Diseases associated with PDE3A include Hypertension And Brachydactyly Syndrome and Brachydactyly. Among its related pathways are Development Beta-adrenergic receptors regulation of ERK and CREB Pathway. Gene Ontology (GO) annotations related to this gene include 3',5'-cyclic-nucleotide phosphodiesterase activity and 3',5'-cyclic-AMP phosphodiesterase activity. An important paralog of this gene is PDE3B.","Cyclic nucleotide phosphodiesterase with specificity for the second messengers cAMP and cGMP, which are key regulators of many important physiological processes (PubMed:1315035, PubMed:8695850, PubMed:8155697, PubMed:25961942). Has also activity toward cUMP (PubMed:27975297). Independently of its catalytic activity it is part of an E2/17beta-estradiol-induced pro-apoptotic signaling pathway. E2 stabilizes the PDE3A/SLFN12 complex in the cytosol, promoting the dephosphorylation of SLFN12 and activating its pro-apoptotic ribosomal RNA/rRNA ribonuclease activity. This apoptotic pathway might be relevant in tissues with high concentration of E2 and be for instance involved in placenta remodeling (PubMed:31420216, PubMed:34707099). PDE3A_HUMAN,Q14432","Phosphodiesterases (PDEs) are a family of phosphohydrolyases that catalyze the hydrolysis of 3' cyclic phosphate bonds in adenosine and/or guanine 3',5' cyclic monophosphate (cAMP and/or cGMP). PDEs regulate the second messengers by controlling their degradation.",
ITPR2,"Gene - Inositol 1,4,5-Trisphosphate Receptor Type 2","The protein encoded by this gene belongs to the inositol 1,4,5-triphosphate receptor family, whose members are second messenger intracellular calcium release channels. These proteins mediate a rise in cytoplasmic calcium in response to receptor activated production of inositol triphosphate. Inositol triphosphate receptor-mediated signaling is involved in many processes including cell migration, cell division, smooth muscle contraction, and neuronal signaling. This protein is a type 2 receptor that consists of a cytoplasmic amino-terminus that binds inositol triphosphate, six membrane-spanning helices that contribute to the ion pore, and a short cytoplasmic carboxy-terminus. A mutation in this gene has been associated with anhidrosis, suggesting that intracellular calcium release mediated by this protein is required for eccrine sweat production. [provided by RefSeq, Apr 2015]","ITPR2 (Inositol 1,4,5-Trisphosphate Receptor Type 2) is a Protein Coding gene. Diseases associated with ITPR2 include Anhidrosis, Isolated, With Normal Sweat Glands and Anhidrosis. Among its related pathways are Development Endothelin-1/EDNRA transactivation of EGFR and TCR Signaling (Qiagen). Gene Ontology (GO) annotations related to this gene include binding and phosphatidylinositol binding. An important paralog of this gene is ITPR1.","Receptor for inositol 1,4,5-trisphosphate, a second messenger that mediates the release of intracellular calcium. This release is regulated by cAMP both dependently and independently of PKA (By similarity). ITPR2_HUMAN,Q14571","Inositol 1,4,5-trisphosphate (IP3) receptors are a form of ligand-gated ion channels that are activated by cytosolic Ca2+ and IP3. They are localized to intracellular membranes, such as the endoplasmic reticulum, and mediate the mobilization of intracellular Ca2+ stores.",
