Gene,Description,Entrez Gene,GeneCards,UniProtKB/Swiss-Prot,Tocris,CIViC
CFAP74,Gene - Cilia And Flagella Associated Protein 74,"Predicted to be involved in axoneme assembly. Predicted to be located in axoneme. [provided by Alliance of Genome Resources, Apr 2022]",CFAP74 (Cilia And Flagella Associated Protein 74) is a Protein Coding gene. Diseases associated with CFAP74 include Familial Cold Autoinflammatory Syndrome 2 and Chromosome 1P36 Deletion Syndrome.,"As part of the central apparatus of the cilium axoneme may play a role in cilium movement. CFA74_HUMAN,Q9C0B2",,
PRDM16-DT,Gene - PRDM16 Divergent Transcript,,"PRDM16-DT (PRDM16 Divergent Transcript) is an RNA Gene, and is affiliated with the lncRNA class. Diseases associated with PRDM16-DT include Gastric Adenocarcinoma and Gastric Cancer.",,,
AGMAT,Gene - Agmatinase,"Predicted to enable agmatinase activity. Predicted to be involved in putrescine biosynthetic process from arginine, using agmatinase. Predicted to be located in mitochondrion. [provided by Alliance of Genome Resources, Apr 2022]",AGMAT (Agmatinase) is a Protein Coding gene. Diseases associated with AGMAT include Moyamoya Angiopathy and Dry Eye Syndrome. Among its related pathways are putrescine biosynthesis I and Regulation of expression of SLITs and ROBOs. Gene Ontology (GO) annotations related to this gene include agmatinase activity. An important paralog of this gene is ARG2.,,,
MACF1,Gene - Microtubule Actin Crosslinking Factor 1,"This gene encodes a large protein containing numerous spectrin and leucine-rich repeat (LRR) domains. The encoded protein is a member of a family of proteins that form bridges between different cytoskeletal elements. This protein facilitates actin-microtubule interactions at the cell periphery and couples the microtubule network to cellular junctions. Alternative splicing results in multiple transcript variants, but the full-length nature of some of these variants has not been determined. [provided by RefSeq, May 2013]",MACF1 (Microtubule Actin Crosslinking Factor 1) is a Protein Coding gene. Diseases associated with MACF1 include Lissencephaly 9 With Complex Brainstem Malformation and Lissencephaly. Among its related pathways are Mesodermal commitment pathway. Gene Ontology (GO) annotations related to this gene include nucleic acid binding and calcium ion binding. An important paralog of this gene is DST.,"[Isoform 2]: F-actin-binding protein which plays a role in cross-linking actin to other cytoskeletal proteins and also binds to microtubules (PubMed:15265687, PubMed:20937854). Plays an important role in ERBB2-dependent stabilization of microtubules at the cell cortex (PubMed:20937854). Acts as a positive regulator of Wnt receptor signaling pathway and is involved in the translocation of AXIN1 and its associated complex (composed of APC, CTNNB1 and GSK3B) from the cytoplasm to the cell membrane (By similarity). Has actin-regulated ATPase activity and is essential for controlling focal adhesions (FAs) assembly and dynamics (By similarity). Interaction with CAMSAP3 at the minus ends of non-centrosomal microtubules tethers microtubules minus-ends to actin filaments, regulating focal adhesion size and cell migration (PubMed:27693509). May play role in delivery of transport vesicles containing GPI-linked proteins from the trans-Golgi network through its interaction with GOLGA4 (PubMed:15265687). Plays a key role in wound healing and epidermal cell migration (By similarity). Required for efficient upward migration of bulge cells in response to wounding and this function is primarily rooted in its ability to coordinate microtubule dynamics and polarize hair follicle stem cells (By similarity). As a regulator of actin and microtubule arrangement and stabilization, it plays an essential role in neurite outgrowth, branching and spine formation during brain development (By similarity). MACF1_HUMAN,Q9UPN3",,
NFIA,Gene - Nuclear Factor I A,"This gene encodes a member of the NF1 (nuclear factor 1) family of transcription factors. Multiple transcript variants encoding different isoforms have been found for this gene. [provided by RefSeq, Sep 2011]","NFIA (Nuclear Factor I A) is a Protein Coding gene. Diseases associated with NFIA include Brain Malformations With Or Without Urinary Tract Defects and Cleft Palate, Isolated. Among its related pathways are Gene expression (Transcription) and RNA Polymerase III Transcription Initiation. Gene Ontology (GO) annotations related to this gene include DNA-binding transcription factor activity and RNA polymerase II cis-regulatory region sequence-specific DNA binding. An important paralog of this gene is NFIX.","Recognizes and binds the palindromic sequence 5'-TTGGCNNNNNGCCAA-3' present in viral and cellular promoters and in the origin of replication of adenovirus type 2. These proteins are individually capable of activating transcription and replication. NFIA_HUMAN,Q12857",,
NEGR1,Gene - Neuronal Growth Regulator 1,"Predicted to act upstream of or within several processes, including feeding behavior; locomotory behavior; and positive regulation of neuron projection development. Predicted to be located in extracellular region and plasma membrane. [provided by Alliance of Genome Resources, Apr 2022]",NEGR1 (Neuronal Growth Regulator 1) is a Protein Coding gene. Diseases associated with NEGR1 include Niemann-Pick Disease. Among its related pathways are Metabolism of proteins and Post-translational modification: synthesis of GPI-anchored proteins. An important paralog of this gene is LSAMP.,"May be involved in cell-adhesion. May function as a trans-neural growth-promoting factor in regenerative axon sprouting in the mammalian brain (By similarity). NEGR1_HUMAN,Q7Z3B1",,
BOLA1,Gene - BolA Family Member 1,"Located in mitochondrion. [provided by Alliance of Genome Resources, Apr 2022]",BOLA1 (BolA Family Member 1) is a Protein Coding gene. Diseases associated with BOLA1 include Multiple Mitochondrial Dysfunctions Syndrome 2 With Hyperglycinemia and Multiple Mitochondrial Dysfunctions Syndrome. An important paralog of this gene is BOLA2B.,"Acts as a mitochondrial iron-sulfur (Fe-S) cluster assembly factor that facilitates (Fe-S) cluster insertion into a subset of mitochondrial proteins (By similarity). Probably acts together with the monothiol glutaredoxin GLRX5 (PubMed:27532772). May protect cells against oxidative stress (PubMed:22746225). BOLA1_HUMAN,Q9Y3E2",,
DNM3,Gene - Dynamin 3,"This gene encodes a member of a family of guanosine triphosphate (GTP)-binding proteins that associate with microtubules and are involved in vesicular transport. The encoded protein functions in the development of megakaryocytes. Alternative splicing results in multiple transcript variants. [provided by RefSeq, May 2013]","DNM3 (Dynamin 3) is a Protein Coding gene. Diseases associated with DNM3 include Optic Atrophy With Or Without Deafness, Ophthalmoplegia, Myopathy, Ataxia, And Neuropathy and Centronuclear Myopathy. Among its related pathways are Signaling by Receptor Tyrosine Kinases and Synaptic vesicle pathway. Gene Ontology (GO) annotations related to this gene include GTP binding and GTPase activity. An important paralog of this gene is DNM1.","Microtubule-associated force-producing protein involved in producing microtubule bundles and able to bind and hydrolyze GTP. Most probably involved in vesicular trafficking processes, in particular endocytosis (By similarity). DYN3_HUMAN,Q9UQ16","GTPases are a group of enzymes that catalyze hydrolysis of the gamma phosphate bond in guanine triphosphate (GTP) to form guanine diphosphate (GDP). Mg2+ ions are essential for catalytic activity. GTPases, often coupled to G proteins, are essential in signal transduction.",
LYPLAL1-AS1,Gene - LYPLAL1 Antisense RNA 1,,"LYPLAL1-AS1 (LYPLAL1 Antisense RNA 1) is an RNA Gene, and is affiliated with the lncRNA class.",,,
ZC3H11B,Gene - Zinc Finger CCCH-Type Containing 11B,"Predicted to enable mRNA binding activity. Predicted to be involved in poly(A)+ mRNA export from nucleus. [provided by Alliance of Genome Resources, Apr 2022]",ZC3H11B (Zinc Finger CCCH-Type Containing 11B) is a Protein Coding gene. An important paralog of this gene is ZC3H11A.,"May play a role in mRNA transport. ZC11B_HUMAN,A0A1B0GTU1",,
ASXL2,Gene - ASXL Transcriptional Regulator 2,"This gene encodes a member of a family of epigenetic regulators that bind various histone-modifying enzymes and are involved in the assembly of transcription factors at specific genomic loci. Naturally occurring mutations in this gene are associated with cancer in several tissue types (breast, bladder, pancreas, ovary, prostate, and blood). This gene plays an important role in neurodevelopment, cardiac function, adipogenesis, and osteoclastogenesis. [provided by RefSeq, Feb 2017]",ASXL2 (ASXL Transcriptional Regulator 2) is a Protein Coding gene. Diseases associated with ASXL2 include Shashi-Pena Syndrome and Bainbridge-Ropers Syndrome. Among its related pathways are Metabolism of proteins and Regulation of activated PAK-2p34 by proteasome mediated degradation. Gene Ontology (GO) annotations related to this gene include peroxisome proliferator activated receptor binding. An important paralog of this gene is ASXL3.,"Putative Polycomb group (PcG) protein. PcG proteins act by forming multiprotein complexes, which are required to maintain the transcriptionally repressive state of homeotic genes throughout development. PcG proteins are not required to initiate repression, but to maintain it during later stages of development. They probably act via methylation of histones, rendering chromatin heritably changed in its expressibility (By similarity). Involved in transcriptional regulation mediated by ligand-bound nuclear hormone receptors, such as peroxisome proliferator-activated receptor gamma (PPARG). Acts as coactivator for PPARG and enhances its adipocyte differentiation-inducing activity; the function seems to involve differential recruitment of acetylated and methylated histone H3. ASXL2_HUMAN,Q76L83",,
GCKR,Gene - Glucokinase Regulator,"This gene encodes a protein belonging to the GCKR subfamily of the SIS (Sugar ISomerase) family of proteins. The gene product is a regulatory protein that inhibits glucokinase in liver and pancreatic islet cells by binding non-covalently to form an inactive complex with the enzyme. This gene is considered a susceptibility gene candidate for a form of maturity-onset diabetes of the young (MODY). [provided by RefSeq, Jul 2008]",GCKR (Glucokinase Regulator) is a Protein Coding gene. Diseases associated with GCKR include Fasting Plasma Glucose Level Quantitative Trait Locus 5 and Maturity-Onset Diabetes Of The Young. Among its related pathways are Familial hyperlipidemia type 1 and Transport of the SLBP independent Mature mRNA. Gene Ontology (GO) annotations related to this gene include enzyme binding and protein domain specific binding.,"Regulates glucokinase (GCK) by forming an inactive complex with this enzyme (PubMed:23621087, PubMed:23733961). Acts by promoting GCK recruitment to the nucleus, possibly to provide a reserve of GCK that can be quickly released in the cytoplasm after a meal (PubMed:10456334). The affinity of GCKR for GCK is modulated by fructose metabolites: GCKR with bound fructose 6-phosphate has increased affinity for GCK, while GCKR with bound fructose 1-phosphate has strongly decreased affinity for GCK and does not inhibit GCK activity (PubMed:23621087, PubMed:23733961). GCKR_HUMAN,Q14397",,
CEP68,Gene - Centrosomal Protein 68,"Enables protein domain specific binding activity and protein kinase binding activity. Involved in centriole-centriole cohesion and protein localization to organelle. Located in several cellular components, including centriolar satellite; cytosol; and nucleoplasm. [provided by Alliance of Genome Resources, Apr 2022]",CEP68 (Centrosomal Protein 68) is a Protein Coding gene. Gene Ontology (GO) annotations related to this gene include protein kinase binding and protein domain specific binding. An important paralog of this gene is AKAP6.,"Involved in maintenance of centrosome cohesion, probably as part of a linker structure which prevents centrosome splitting (PubMed:18042621). Required for localization of CDK5RAP2 to the centrosome during interphase (PubMed:24554434, PubMed:25503564). CEP68_HUMAN,Q76N32",,
GLI2,Gene - GLI Family Zinc Finger 2,"This gene encodes a protein which belongs to the C2H2-type zinc finger protein subclass of the Gli family. Members of this subclass are characterized as transcription factors which bind DNA through zinc finger motifs. These motifs contain conserved H-C links. Gli family zinc finger proteins are mediators of Sonic hedgehog (Shh) signaling and they are implicated as potent oncogenes in the embryonal carcinoma cell. The protein encoded by this gene localizes to the cytoplasm and activates patched Drosophila homolog (PTCH) gene expression. It is also thought to play a role during embryogenesis. The encoded protein is associated with several phenotypes- Greig cephalopolysyndactyly syndrome, Pallister-Hall syndrome, preaxial polydactyly type IV, postaxial polydactyly types A1 and B. [provided by RefSeq, Jul 2008]",GLI2 (GLI Family Zinc Finger 2) is a Protein Coding gene. Diseases associated with GLI2 include Culler-Jones Syndrome and Holoprosencephaly 9. Among its related pathways are Ciliopathies and Gene expression (Transcription). Gene Ontology (GO) annotations related to this gene include DNA-binding transcription factor activity and chromatin binding. An important paralog of this gene is GLI3.,"Functions as transcription regulator in the hedgehog (Hh) pathway (PubMed:18455992, PubMed:26565916). Functions as transcriptional activator (PubMed:9557682, PubMed:19878745, PubMed:24311597). May also function as transcriptional repressor (By similarity). Requires STK36 for full transcriptional activator activity. Required for normal embryonic development (PubMed:15994174, PubMed:20685856). GLI2_HUMAN,P10070",,
R3HDM1,Gene - R3H Domain Containing 1,"Enables RNA binding activity. [provided by Alliance of Genome Resources, Apr 2022]",R3HDM1 (R3H Domain Containing 1) is a Protein Coding gene. Gene Ontology (GO) annotations related to this gene include nucleic acid binding and RNA binding. An important paralog of this gene is R3HDM2.,,,
GRB14,Gene - Growth Factor Receptor Bound Protein 14,"The product of this gene belongs to a small family of adapter proteins that are known to interact with a number of receptor tyrosine kinases and signaling molecules. This gene encodes a growth factor receptor-binding protein that interacts with insulin receptors and insulin-like growth-factor receptors. This protein likely has an inhibitory effect on receptor tyrosine kinase signaling and, in particular, on insulin receptor signaling. This gene may play a role in signaling pathways that regulate growth and metabolism. Alternative splicing results in multiple transcript variants. [provided by RefSeq, Dec 2014]",GRB14 (Growth Factor Receptor Bound Protein 14) is a Protein Coding gene. Diseases associated with GRB14 include Type 2 Diabetes Mellitus. Among its related pathways are Response to elevated platelet cytosolic Ca2+ and GPCR Pathway. Gene Ontology (GO) annotations related to this gene include obsolete SH3/SH2 adaptor activity. An important paralog of this gene is GRB10.,"Adapter protein which modulates coupling of cell surface receptor kinases with specific signaling pathways. Binds to, and suppresses signals from, the activated insulin receptor (INSR). Potent inhibitor of insulin-stimulated MAPK3 phosphorylation. Plays a critical role regulating PDPK1 membrane translocation in response to insulin stimulation and serves as an adapter protein to recruit PDPK1 to activated insulin receptor, thus promoting PKB/AKT1 phosphorylation and transduction of the insulin signal. GRB14_HUMAN,Q14449",,
COBLL1,Gene - Cordon-Bleu WH2 Repeat Protein Like 1,"Enables cadherin binding activity. Located in extracellular exosome. [provided by Alliance of Genome Resources, Apr 2022]","COBLL1 (Cordon-Bleu WH2 Repeat Protein Like 1) is a Protein Coding gene. Diseases associated with COBLL1 include Macular Degeneration, Age-Related, 10. Gene Ontology (GO) annotations related to this gene include actin binding. An important paralog of this gene is COBL.",,,
MYO3B,Gene - Myosin IIIB,"This gene encodes one of the class III myosins. Myosins are ATPases, activated by actin, that move along actin filaments in the cell. This class of myosins are characterized by an amino-terminal kinase domain and shown to be present in photoreceptors. Alternative splicing results in multiple transcript variants encoding different isoforms. [provided by RefSeq, Mar 2014]","MYO3B (Myosin IIIB) is a Protein Coding gene. Diseases associated with MYO3B include Deafness, Autosomal Recessive 30 and Entropion. Among its related pathways are Actin Nucleation by ARP-WASP Complex and Olfactory Signaling Pathway. Gene Ontology (GO) annotations related to this gene include transferase activity, transferring phosphorus-containing groups and protein tyrosine kinase activity. An important paralog of this gene is MYO3A.","Probable actin-based motor with a protein kinase activity. Required for normal cochlear hair bundle development and hearing. Plays an important role in the early steps of cochlear hair bundle morphogenesis. Influences the number and lengths of stereocilia to be produced and limits the growth of microvilli within the forming auditory hair bundles thereby contributing to the architecture of the hair bundle, including its staircase pattern. Involved in the elongation of actin in stereocilia tips by transporting the actin regulatory factor ESPN to the plus ends of actin filaments. MYO3B_HUMAN,Q8WXR4",,
TMBIM1,Gene - Transmembrane BAX Inhibitor Motif Containing 1,"Enables death receptor binding activity. Involved in negative regulation of Fas signaling pathway; negative regulation of extrinsic apoptotic signaling pathway via death domain receptors; and negative regulation of protein localization to plasma membrane. Located in Golgi apparatus; endosome membrane; and lysosomal membrane. [provided by Alliance of Genome Resources, Apr 2022]",TMBIM1 (Transmembrane BAX Inhibitor Motif Containing 1) is a Protein Coding gene. Among its related pathways are Innate Immune System. Gene Ontology (GO) annotations related to this gene include death receptor binding. An important paralog of this gene is FAIM2.,"Negatively regulates aortic matrix metalloproteinase-9 (MMP9) production and may play a protective role in vascular remodeling. LFG3_HUMAN,Q969X1",,
STK36,Gene - Serine/Threonine Kinase 36,"This gene encodes a member of the serine/threonine kinase family of enzymes. This family member is similar to a Drosophila protein that plays a key role in the Hedgehog signaling pathway. This human protein is a positive regulator of the GLI zinc-finger transcription factors. Knockout studies of the homologous mouse gene suggest that defects in this human gene may lead to congenital hydrocephalus, possibly due to a functional defect in motile cilia. Because Hedgehog signaling is frequently activated in certain kinds of gastrointestinal cancers, it has been suggested that this gene is a target for the treatment of these cancers. Alternative splicing of this gene results in multiple transcript variants. [provided by RefSeq, Aug 2011]","STK36 (Serine/Threonine Kinase 36) is a Protein Coding gene. Diseases associated with STK36 include Ciliary Dyskinesia, Primary, 46 and Primary Ciliary Dyskinesia. Among its related pathways are Activation of cAMP-Dependent PKA and Sweet Taste Signaling. Gene Ontology (GO) annotations related to this gene include transferase activity, transferring phosphorus-containing groups and protein tyrosine kinase activity. An important paralog of this gene is ULK4.","Serine/threonine protein kinase which plays an important role in the sonic hedgehog (Shh) pathway by regulating the activity of GLI transcription factors (PubMed:10806483). Controls the activity of the transcriptional regulators GLI1, GLI2 and GLI3 by opposing the effect of SUFU and promoting their nuclear localization (PubMed:10806483). GLI2 requires an additional function of STK36 to become transcriptionally active, but the enzyme does not need to possess an active kinase catalytic site for this to occur (PubMed:10806483). Required for postnatal development, possibly by regulating the homeostasis of cerebral spinal fluid or ciliary function. Essential for construction of the central pair apparatus of motile cilia. STK36_HUMAN,Q9NRP7",,
CYP27A1,Gene - Cytochrome P450 Family 27 Subfamily A Member 1,"This gene encodes a member of the cytochrome P450 superfamily of enzymes. The cytochrome P450 proteins are monooxygenases which catalyze many reactions involved in drug metabolism and synthesis of cholesterol, steroids and other lipids. This mitochondrial protein oxidizes cholesterol intermediates as part of the bile synthesis pathway. Since the conversion of cholesterol to bile acids is the major route for removing cholesterol from the body, this protein is important for overall cholesterol homeostasis. Mutations in this gene cause cerebrotendinous xanthomatosis, a rare autosomal recessive lipid storage disease. [provided by RefSeq, Jul 2008]","CYP27A1 (Cytochrome P450 Family 27 Subfamily A Member 1) is a Protein Coding gene. Diseases associated with CYP27A1 include Cerebrotendinous Xanthomatosis and Xanthomatosis. Among its related pathways are Oxidation by cytochrome P450 and PPAR signaling pathway. Gene Ontology (GO) annotations related to this gene include iron ion binding and oxidoreductase activity, acting on paired donors, with incorporation or reduction of molecular oxygen. An important paralog of this gene is CYP27B1.","Cytochrome P450 monooxygenase that catalyzes regio- and stereospecific hydroxylation of cholesterol and its derivatives. Hydroxylates (with R stereochemistry) the terminal methyl group of cholesterol side-chain in a three step reaction to yield at first a C26 alcohol, then a C26 aldehyde and finally a C26 acid (PubMed:9660774, PubMed:12077124, PubMed:21411718, PubMed:28190002). Regulates cholesterol homeostasis by catalyzing the conversion of excess cholesterol to bile acids via both the 'neutral' (classic) and the 'acid' (alternative) pathways (PubMed:9660774, PubMed:1708392, PubMed:11412116, PubMed:2019602, PubMed:7915755, PubMed:9186905, PubMed:9790667). May also regulate cholesterol homeostasis via generation of active oxysterols, which act as ligands for NR1H2 and NR1H3 nuclear receptors, modulating the transcription of genes involved in lipid metabolism (PubMed:9660774, PubMed:12077124). Plays a role in cholestanol metabolism in the cerebellum. Similarly to cholesterol, hydroxylates cholestanol and may facilitate sterol diffusion through the blood-brain barrier to the systemic circulation for further degradation (PubMed:28190002). Also hydroxylates retinal 7-ketocholesterol, a noxious oxysterol with pro-inflammatory and pro-apoptotic effects, and may play a role in its elimination from the retinal pigment epithelium (PubMed:21411718). May play a redundant role in vitamin D biosynthesis. Catalyzes 25-hydroxylation of vitamin D3 that is required for its conversion to a functionally active form (PubMed:15465040). CP27A_HUMAN,Q02318",,
LOC646736,Gene - Uncharacterized LOC646736,,"LOC646736 (Uncharacterized LOC646736) is an RNA Gene, and is affiliated with the lncRNA class.",,,
PPARG,Gene - Peroxisome Proliferator Activated Receptor Gamma,"This gene encodes a member of the peroxisome proliferator-activated receptor (PPAR) subfamily of nuclear receptors. PPARs form heterodimers with retinoid X receptors (RXRs) and these heterodimers regulate transcription of various genes. Three subtypes of PPARs are known: PPAR-alpha, PPAR-delta, and PPAR-gamma. The protein encoded by this gene is PPAR-gamma and is a regulator of adipocyte differentiation. Additionally, PPAR-gamma has been implicated in the pathology of numerous diseases including obesity, diabetes, atherosclerosis and cancer. Alternatively spliced transcript variants that encode different isoforms have been described. [provided by RefSeq, Jul 2008]","PPARG (Peroxisome Proliferator Activated Receptor Gamma) is a Protein Coding gene. Diseases associated with PPARG include Lipodystrophy, Familial Partial, Type 3 and Body Mass Index Quantitative Trait Locus 11. Among its related pathways are Adipogenesis and Metabolism of proteins. Gene Ontology (GO) annotations related to this gene include DNA-binding transcription factor activity and chromatin binding. An important paralog of this gene is PPARA.","Nuclear receptor that binds peroxisome proliferators such as hypolipidemic drugs and fatty acids. Once activated by a ligand, the nuclear receptor binds to DNA specific PPAR response elements (PPRE) and modulates the transcription of its target genes, such as acyl-CoA oxidase. It therefore controls the peroxisomal beta-oxidation pathway of fatty acids. Key regulator of adipocyte differentiation and glucose homeostasis. ARF6 acts as a key regulator of the tissue-specific adipocyte P2 (aP2) enhancer. Acts as a critical regulator of gut homeostasis by suppressing NF-kappa-B-mediated pro-inflammatory responses. Plays a role in the regulation of cardiovascular circadian rhythms by regulating the transcription of ARNTL/BMAL1 in the blood vessels (By similarity). PPARG_HUMAN,P37231",Peroxisome proliferator-activated receptor gamma (PPARgamma) is a member of the nuclear receptor family of ligand-activated transcription factors that heterodimerize with the retinoic X receptor (RXR) to regulate gene expression.,
